{
    "method": "get",
    "options": {
        "auth": [
            "root",
            "root"
        ],
        "headers": {
            "Accept": "application/json",
            "Host": "localhost:8080"
        }
    },
    "path": "/@apidefinition",
    "path_scheme": "@apidefinition",
    "request": "GET /@apidefinition HTTP/1.1\nAccept: application/json\nHost: localhost:8080\nAuthorization: Basic cm9vdDpyb290\n\n",
    "response": "HTTP/1.1 200 OK\nContent-Type: application/json\nServer: Python/3.6 aiohttp/1.3.3\n\n{\n    \"guillotina.interfaces.content.IApplication\": {\n        \"GET\": {\n            \"context\": [\n                \"guillotina.interfaces.content.IApplication\",\n                \"guillotina.interfaces.content.ITraversable\",\n                \"zope.interface.Interface\"\n            ],\n            \"description\": \"Retrieves serialization of application\",\n            \"method\": \"GET\",\n            \"module\": \"guillotina.api.app.get\",\n            \"permission\": \"guillotina.AccessContent\",\n            \"title\": \"Get application data\"\n        },\n        \"PUT\": {\n            \"context\": [\n                \"guillotina.interfaces.content.IApplication\",\n                \"guillotina.interfaces.content.ITraversable\",\n                \"zope.interface.Interface\"\n            ],\n            \"method\": \"PUT\",\n            \"permission\": \"guillotina.MountDatabase\"\n        },\n        \"endpoints\": {\n            \"@apidefinition\": {\n                \"context\": [\n                    \"guillotina.interfaces.content.IApplication\",\n                    \"guillotina.interfaces.content.ITraversable\",\n                    \"zope.interface.Interface\"\n                ],\n                \"description\": \"Retrieves information on API configuration\",\n                \"method\": \"GET\",\n                \"module\": \"guillotina.api.app.get_api_definition\",\n                \"name\": \"@apidefinition\",\n                \"permission\": \"guillotina.GetPortals\",\n                \"title\": \"Get API Definition\"\n            }\n        }\n    },\n    \"guillotina.interfaces.content.IDatabase\": {\n        \"DELETE\": {\n            \"context\": [\n                \"guillotina.interfaces.content.IDatabase\",\n                \"guillotina.interfaces.content.ITraversable\",\n                \"guillotina.interfaces.content.IAsyncContainer\",\n                \"zope.interface.Interface\"\n            ],\n            \"method\": \"DELETE\",\n            \"permission\": \"guillotina.UmountDatabase\"\n        },\n        \"GET\": {\n            \"context\": [\n                \"guillotina.interfaces.content.IDatabase\",\n                \"guillotina.interfaces.content.ITraversable\",\n                \"guillotina.interfaces.content.IAsyncContainer\",\n                \"zope.interface.Interface\"\n            ],\n            \"method\": \"GET\",\n            \"permission\": \"guillotina.GetPortals\"\n        },\n        \"POST\": {\n            \"context\": [\n                \"guillotina.interfaces.content.IDatabase\",\n                \"guillotina.interfaces.content.ITraversable\",\n                \"guillotina.interfaces.content.IAsyncContainer\",\n                \"zope.interface.Interface\"\n            ],\n            \"description\": \"Creates a new site on the database\",\n            \"method\": \"POST\",\n            \"payload\": {\n                \"payload\": {\n                    \"@type\": \"string\",\n                    \"id\": \"string\",\n                    \"title\": \"string\"\n                },\n                \"query\": {},\n                \"traversal\": []\n            },\n            \"permission\": \"guillotina.AddPortal\",\n            \"title\": \"Create a new Portal\"\n        }\n    },\n    \"guillotina.interfaces.content.IResource\": {\n        \"DELETE\": {\n            \"context\": [\n                \"guillotina.interfaces.content.IResource\",\n                \"guillotina.interfaces.content.ILocation\",\n                \"zope.interface.Interface\"\n            ],\n            \"description\": \"Delete resource\",\n            \"method\": \"DELETE\",\n            \"permission\": \"guillotina.DeleteContent\"\n        },\n        \"GET\": {\n            \"context\": [\n                \"guillotina.interfaces.content.IResource\",\n                \"guillotina.interfaces.content.ILocation\",\n                \"zope.interface.Interface\"\n            ],\n            \"description\": \"Retrieves serialization of resource\",\n            \"method\": \"GET\",\n            \"permission\": \"guillotina.ViewContent\"\n        },\n        \"OPTIONS\": {\n            \"context\": [\n                \"guillotina.interfaces.content.IResource\",\n                \"guillotina.interfaces.content.ILocation\",\n                \"zope.interface.Interface\"\n            ],\n            \"description\": \"Get CORS information for resource\",\n            \"method\": \"OPTIONS\",\n            \"permission\": \"guillotina.AccessPreflight\"\n        },\n        \"PATCH\": {\n            \"context\": [\n                \"guillotina.interfaces.content.IResource\",\n                \"guillotina.interfaces.content.ILocation\",\n                \"zope.interface.Interface\"\n            ],\n            \"description\": \"Modify the content of this resource\",\n            \"method\": \"PATCH\",\n            \"permission\": \"guillotina.ModifyContent\"\n        },\n        \"POST\": {\n            \"context\": [\n                \"guillotina.interfaces.content.IResource\",\n                \"guillotina.interfaces.content.ILocation\",\n                \"zope.interface.Interface\"\n            ],\n            \"description\": \"Add new resouce inside this container resource\",\n            \"method\": \"POST\",\n            \"permission\": \"guillotina.AddContent\"\n        },\n        \"PUT\": {\n            \"context\": [\n                \"guillotina.interfaces.content.IResource\",\n                \"guillotina.interfaces.content.ILocation\",\n                \"zope.interface.Interface\"\n            ],\n            \"method\": \"PUT\",\n            \"permission\": \"guillotina.ModifyContent\"\n        },\n        \"endpoints\": {\n            \"@all_permissions\": {\n                \"context\": [\n                    \"guillotina.interfaces.content.IResource\",\n                    \"guillotina.interfaces.content.ILocation\",\n                    \"zope.interface.Interface\"\n                ],\n                \"description\": \"See all permission settings for this resource\",\n                \"method\": \"GET\",\n                \"module\": \"guillotina.api.content.all_permissions\",\n                \"name\": \"@all_permissions\",\n                \"permission\": \"guillotina.SeePermissions\"\n            },\n            \"@async-catalog-reindex\": {\n                \"context\": [\n                    \"guillotina.interfaces.content.IResource\",\n                    \"guillotina.interfaces.content.ILocation\",\n                    \"zope.interface.Interface\"\n                ],\n                \"method\": \"POST\",\n                \"name\": \"@async-catalog-reindex\",\n                \"permission\": \"guillotina.ReindexContent\"\n            },\n            \"@behaviors\": {\n                \"context\": [\n                    \"guillotina.interfaces.content.IResource\",\n                    \"guillotina.interfaces.content.ILocation\",\n                    \"zope.interface.Interface\"\n                ],\n                \"description\": \"Get information on behaviors for this resource\",\n                \"method\": \"GET\",\n                \"module\": \"guillotina.api.behaviors.default_get\",\n                \"name\": \"@behaviors\",\n                \"permission\": \"guillotina.AccessContent\"\n            },\n            \"@canido\": {\n                \"context\": [\n                    \"guillotina.interfaces.content.IResource\",\n                    \"guillotina.interfaces.content.ILocation\",\n                    \"zope.interface.Interface\"\n                ],\n                \"method\": \"GET\",\n                \"module\": \"guillotina.api.content.can_i_do\",\n                \"name\": \"@canido\",\n                \"permission\": \"guillotina.AccessContent\"\n            },\n            \"@catalog\": {\n                \"context\": [\n                    \"guillotina.interfaces.content.IResource\",\n                    \"guillotina.interfaces.content.ILocation\",\n                    \"zope.interface.Interface\"\n                ],\n                \"method\": \"DELETE\",\n                \"module\": \"guillotina.api.search.catalog_delete\",\n                \"name\": \"@catalog\",\n                \"permission\": \"guillotina.ManageCatalog\"\n            },\n            \"@catalog-reindex\": {\n                \"context\": [\n                    \"guillotina.interfaces.content.IResource\",\n                    \"guillotina.interfaces.content.ILocation\",\n                    \"zope.interface.Interface\"\n                ],\n                \"method\": \"POST\",\n                \"name\": \"@catalog-reindex\",\n                \"permission\": \"guillotina.ReindexContent\"\n            },\n            \"@download\": {\n                \"context\": [\n                    \"guillotina.interfaces.content.IResource\",\n                    \"guillotina.interfaces.content.ILocation\",\n                    \"zope.interface.Interface\"\n                ],\n                \"method\": \"GET\",\n                \"name\": \"@download\",\n                \"permission\": \"guillotina.ViewContent\"\n            },\n            \"@search\": {\n                \"context\": [\n                    \"guillotina.interfaces.content.IResource\",\n                    \"guillotina.interfaces.content.ILocation\",\n                    \"zope.interface.Interface\"\n                ],\n                \"method\": \"POST\",\n                \"module\": \"guillotina.api.search.search_post\",\n                \"name\": \"@search\",\n                \"permission\": \"guillotina.RawSearchContent\"\n            },\n            \"@sharing\": {\n                \"context\": [\n                    \"guillotina.interfaces.content.IResource\",\n                    \"guillotina.interfaces.content.ILocation\",\n                    \"zope.interface.Interface\"\n                ],\n                \"method\": \"POST\",\n                \"module\": \"guillotina.api.content.sharing_post\",\n                \"name\": \"@sharing\",\n                \"permission\": \"guillotina.ChangePermissions\"\n            },\n            \"@tusupload\": {\n                \"context\": [\n                    \"guillotina.interfaces.content.IResource\",\n                    \"guillotina.interfaces.content.ILocation\",\n                    \"zope.interface.Interface\"\n                ],\n                \"method\": \"OPTIONS\",\n                \"name\": \"@tusupload\",\n                \"permission\": \"guillotina.AccessPreflight\"\n            },\n            \"@upload\": {\n                \"context\": [\n                    \"guillotina.interfaces.content.IResource\",\n                    \"guillotina.interfaces.content.ILocation\",\n                    \"zope.interface.Interface\"\n                ],\n                \"method\": \"PATCH\",\n                \"name\": \"@upload\",\n                \"permission\": \"guillotina.ModifyContent\"\n            }\n        }\n    },\n    \"guillotina.interfaces.content.ISite\": {\n        \"DELETE\": {\n            \"context\": [\n                \"guillotina.interfaces.content.ISite\",\n                \"guillotina.interfaces.content.IResource\",\n                \"guillotina.interfaces.content.ILocation\",\n                \"guillotina.component.interfaces.ISite\",\n                \"guillotina.component.interfaces.IPossibleSite\",\n                \"guillotina.interfaces.content.ITraversable\",\n                \"guillotina.interfaces.content.IAsyncContainer\",\n                \"zope.interface.Interface\"\n            ],\n            \"method\": \"DELETE\",\n            \"permission\": \"guillotina.DeletePortals\"\n        },\n        \"endpoints\": {\n            \"@addons\": {\n                \"context\": [\n                    \"guillotina.interfaces.content.ISite\",\n                    \"guillotina.interfaces.content.IResource\",\n                    \"guillotina.interfaces.content.ILocation\",\n                    \"guillotina.component.interfaces.ISite\",\n                    \"guillotina.component.interfaces.IPossibleSite\",\n                    \"guillotina.interfaces.content.ITraversable\",\n                    \"guillotina.interfaces.content.IAsyncContainer\",\n                    \"zope.interface.Interface\"\n                ],\n                \"method\": \"GET\",\n                \"module\": \"guillotina.api.addons.get_addons\",\n                \"name\": \"@addons\",\n                \"permission\": \"guillotina.ManageAddons\"\n            },\n            \"@registry\": {\n                \"context\": [\n                    \"guillotina.interfaces.content.ISite\",\n                    \"guillotina.interfaces.content.IResource\",\n                    \"guillotina.interfaces.content.ILocation\",\n                    \"guillotina.component.interfaces.ISite\",\n                    \"guillotina.component.interfaces.IPossibleSite\",\n                    \"guillotina.interfaces.content.ITraversable\",\n                    \"guillotina.interfaces.content.IAsyncContainer\",\n                    \"zope.interface.Interface\"\n                ],\n                \"method\": \"PATCH\",\n                \"name\": \"@registry\",\n                \"permission\": \"guillotina.WriteConfiguration\"\n            },\n            \"@types\": {\n                \"context\": [\n                    \"guillotina.interfaces.content.ISite\",\n                    \"guillotina.interfaces.content.IResource\",\n                    \"guillotina.interfaces.content.ILocation\",\n                    \"guillotina.component.interfaces.ISite\",\n                    \"guillotina.component.interfaces.IPossibleSite\",\n                    \"guillotina.interfaces.content.ITraversable\",\n                    \"guillotina.interfaces.content.IAsyncContainer\",\n                    \"zope.interface.Interface\"\n                ],\n                \"description\": \"Read information on available types\",\n                \"method\": \"GET\",\n                \"name\": \"@types\",\n                \"permission\": \"guillotina.AccessContent\"\n            },\n            \"@user\": {\n                \"context\": [\n                    \"guillotina.interfaces.content.ISite\",\n                    \"guillotina.interfaces.content.IResource\",\n                    \"guillotina.interfaces.content.ILocation\",\n                    \"guillotina.component.interfaces.ISite\",\n                    \"guillotina.component.interfaces.IPossibleSite\",\n                    \"guillotina.interfaces.content.ITraversable\",\n                    \"guillotina.interfaces.content.IAsyncContainer\",\n                    \"zope.interface.Interface\"\n                ],\n                \"description\": \"Get information on the currently logged in user\",\n                \"method\": \"GET\",\n                \"module\": \"guillotina.api.user.get_user_info\",\n                \"name\": \"@user\",\n                \"permission\": \"guillotina.AccessContent\"\n            },\n            \"@ws\": {\n                \"context\": [\n                    \"guillotina.interfaces.content.ISite\",\n                    \"guillotina.interfaces.content.IResource\",\n                    \"guillotina.interfaces.content.ILocation\",\n                    \"guillotina.component.interfaces.ISite\",\n                    \"guillotina.component.interfaces.IPossibleSite\",\n                    \"guillotina.interfaces.content.ITraversable\",\n                    \"guillotina.interfaces.content.IAsyncContainer\",\n                    \"zope.interface.Interface\"\n                ],\n                \"method\": \"GET\",\n                \"name\": \"@ws\",\n                \"permission\": \"guillotina.AccessContent\"\n            },\n            \"@wstoken\": {\n                \"context\": [\n                    \"guillotina.interfaces.content.ISite\",\n                    \"guillotina.interfaces.content.IResource\",\n                    \"guillotina.interfaces.content.ILocation\",\n                    \"guillotina.component.interfaces.ISite\",\n                    \"guillotina.component.interfaces.IPossibleSite\",\n                    \"guillotina.interfaces.content.ITraversable\",\n                    \"guillotina.interfaces.content.IAsyncContainer\",\n                    \"zope.interface.Interface\"\n                ],\n                \"method\": \"GET\",\n                \"name\": \"@wstoken\",\n                \"permission\": \"guillotina.AccessContent\"\n            }\n        }\n    },\n    \"guillotina.interfaces.content.IStaticFile\": {\n        \"GET\": {\n            \"context\": [\n                \"guillotina.interfaces.content.IStaticFile\",\n                \"zope.interface.Interface\"\n            ],\n            \"method\": \"GET\",\n            \"permission\": \"guillotina.AccessContent\"\n        }\n    }\n}",
    "service": {
        "context": "guillotina.interfaces.content.IApplication",
        "description": "Retrieves information on API configuration",
        "method": "GET",
        "name": "@apidefinition",
        "payload": null,
        "permission": "guillotina.GetPortals",
        "query_params": null,
        "title": "Get API Definition"
    }
}